,GlobalID,Detection Date,Notes,Lab Status,Lab Comments,Submission Date,Latitude,Longitude,d,k
917,{7FFAFD82-24E6-4B3E-B106-96709CE78459},2020-05-25,Today (01JUN2020) Went back to the pink rhododendron bush where I spotted a Asian giant hornet sleeping on a leaf last week on a similar crisp morning. it was beautiful but I didnt have my phone on me as i was at work in canyon park bothell.  Again it wa,Unverified, ,2020-06-01,47.797396,-122.205807,0.26918694740679977,0.21951219512195122
820,{9457CB27-93B0-4AC5-AE32-1C947884C232},2020-05-26,"Was orange and about am inch long, working the buttercups in my yard.",Unverified, ,2020-05-26,48.978787,-122.719183,0.02481732142314587,0.1951219512195122
1183,{935BBC3F-62A5-4395-AC9E-369DE89FCC42},2020-05-26,"I submitted this 5/27 and haven't heard back.  Seen through my first floor apartment window. Whole face orange. Dramatic black eyes.  Back end curled.  About an inch and a half long. It ""attacked"" my window.  Bugs fly into windows, but this came at it 3",Unverified,"Sorry, Candace. We can't identify something without a photograph.",2020-06-25,47.608254,-122.312614,0.3017937441132683,0.4878048780487805
827,{5A1BF997-39E2-41C1-A3EE-E080F2FFFBD2},2020-05-26,"Seen through my first floor apartment window. Whole face orange. Dramatic black eyes.  Back end curled.  About an inch and a half long. It ""attacked"" my window.  Bugs fly into windows, but this came at it 3 times. I'm sorry I didn't get a picture. But th",Unverified, ,2020-05-27,47.608254,-122.312614,0.3017937441132683,0.4878048780487805
824,{5DFAF39F-5189-487B-A175-24181A8BFAEF},2020-05-26,I have caught a very large bee/ hornet,Unverified, ,2020-05-26,48.948935,-122.460942,0.061077689666697056,0.2926829268292683
823,{9D3ECF89-74B3-4153-910B-61C6778AE3F7},2020-05-26,I was cleaning out ivy underneath our laurel hedge and think I saw one on the fence behind the hedge.  I didn't have my phone so couldn't get a picture.  It was 1 to 1.5 inches long and had the balck and yellow stripes on it's back.  It flew away before,Unverified, ,2020-05-26,47.577402,-122.28934,0.3089926472822289,0.2682926829268293
2776,{96914ECE-2A28-4875-A80A-9F3B1AB55DE3},2020-05-27,"Found by entering shed. Hornet ""bumped"" me away from nest location on shed roof. Hornet was large and had a very distinct head. Observed it enter a paper nest with single enterance on bottom. Ran into unlocked shed and sprayed with hornet killer and crus",Unverified, ,2020-08-13,47.238137,-122.793129,0.36687441132683135,0.0
835,{D31FBA8F-EB94-45B8-8300-87E358348D92},2020-05-27,Flying around backyard 26th. Found on car windshield 27th,Unverified, ,2020-05-28,45.821125,-120.826495,0.7312270227569654,0.0
833,{BC3F6279-D53E-4DA3-A9FD-664F125E54D2},2020-05-27,"Hit windshield and stayed on wiper for two seconds.  Wa. highway 20, about MP 76, red cabin creek",Unverified, ,2020-05-27,47.954596,-120.997067,0.3454979795217695,0.0
828,{0D1EEEBD-92A6-479E-B0D2-65AA9327BDF2},2020-05-27,A very large wasp flu by me while I was in my backyard about 5 feet away. It was bigger than any beer wise by Everseen as it flew its wings made a flutter and sound as opposed to a buzzing sound it was somewhere to close to 2 inches long could not get a,Unverified, ,2020-05-27,47.84376,-122.197823,0.26058662230729496,0.24390243902439024
825,{1D411BC5-4336-461F-A409-C06DE1AC77D5},2020-05-27,This is the last time i will tell you. I have seen these bees on my property for least 25 years. They are not suddenly NEW to here,Unverified, ,2020-05-27,48.007309,-122.086087,0.2366238264515541,0.17073170731707318
939,{F69F6080-E837-4394-81C6-DC4383227992},2020-05-27,On the ground / pumping abdomen up and down.,Unverified, ,2020-06-03,48.733899,-122.449012,0.0836390635918938,0.6341463414634146
889,{A772B2D5-A18D-4A7E-AE8F-A09F6378F1DD},2020-05-27,"It cames 2 or 3 days in a row, banging on my window screen.",Unverified, ,2020-05-30,47.551356,-122.176917,0.3192317625254459,0.21951219512195122
931,{EA7753C6-0776-4810-A8AE-412DA092A0D1},2020-05-27,"I definitely had one on my back porch, it was huge, with an orangey red bum and a large stinger. It did not cross my mind to take a photo until I saw this post from Custer but it was 100% the same thing.",Unverified,"If you happen to see it again, please snap a photo and resubmit a sighting.",2020-06-02,48.75973,-122.46785,0.07813591893780573,0.8292682926829268
940,{B5C419D8-5818-418C-A508-C1617D58C41E},2020-05-28,I  killed one in the Cedar lane park in Auburn last week. I did not get a photo. It definitely was a huge murder hornet.,Unverified, ,2020-06-03,47.285136,-122.215773,0.3711546349466776,0.14634146341463414
848,{5F32ACCB-9189-4400-B20F-F75292775687},2020-05-28, ,Unverified, ,2020-05-29,48.37991,-123.71614,0.16022354388843316,0.0
894,{FA174F57-9A79-479B-BD22-11B0E473D211},2020-05-28,"I was watering my garden and heard the loudest buzzing. It wasn’t like a hummingbird’s wings, but like an insect, but just as loud as a hummingbird. I heard it coming toward me and I ducked, when I looked up a HUGE (2+ in) insect flew above me. It lo",Unverified, ,2020-05-30,48.795624,-122.480752,0.07211056421474799,0.3170731707317073
846,{7C6DD972-8AE9-4791-A6AA-39A210F90A0B},2020-05-28,Black upper body striped lower body orange yellow head a little over 2 inches in length rounded body very unique  looking I was trained and licensed by wa dept of agi as a pest control technician  and worked the olympia lacey area and south for about a y,Unverified,"This is will be an unverified sighting, but if you happen to snap a photo of the insect, please resubmit.",2020-05-28,47.056078,-122.762338,0.4055274511591164,0.07317073170731707
860,{5A33A14D-DA18-4404-8DA9-831E6A90E705},2020-05-28,"I was watering and it flew into the stream of water after which it crawled on the ground.  I've never before seen such a large hornet and wish I'd had the presence of mind to take a photo, instead I got a jar and tried to capture it but it flew away.",Unverified, ,2020-05-29,47.513461,-122.254553,0.3233543736517485,0.14634146341463414
845,{05C65EFE-2F15-4D91-BCE5-BBAD9F0A9253},2020-05-28,Hovered over our newly filled pool and landed and then flew up into our neighbors tree,Unverified, ,2020-05-28,45.618621,-122.508845,0.7110336341263332,0.04878048780487805
844,{1F71BA5C-3251-4BB4-B694-4C62C399625C},2020-05-28, ,Unverified, ,2020-05-28,47.081736,-122.2808,0.410426731078905,0.04878048780487805
843,{69A50811-D61D-4FCB-9D8B-87B547F8218A},2020-05-28,Briefly saw a single hornet resting on our porch that was 1-1.5” long. This hornet most resembled pictures of the Asian Giant Hornet pictured on your website. Possibly related was a massive colony/swarm of bees that seemed to be relocating 3 weeks ago.,Unverified, ,2020-05-28,45.692676,-122.696966,0.6934645884604869,0.024390243902439025
842,{AF5F1AC0-EAAD-4F65-8A80-DE2C902778F4},2020-05-28,Hugh hornet at first I thought it was a big moth cause the wings were so big then I saw the stripes my dog ate it before I could stop her,Unverified, ,2020-05-28,47.757443,-117.344623,0.8214193479780028,0.0
896,{76CB29A8-8EEF-4C4E-A9F8-2D674CF66AFC},2020-05-28,"The hornet was flying like in slow motion right pass me and was large, not like a wasp or yellow jacket.  Sorry no photo.  The area was a Supply yard.",Unverified, ,2020-05-30,48.4586,-122.328719,0.1379641023303862,0.0975609756097561
883,{4E19A03F-88D4-4294-8D78-0812E39667A9},2020-05-28,"Hornet was more Orange than usual, appears to be a new breed, had a couple get in my car when window open. Near Penders Canyon",Unverified, ,2020-05-30,48.09955,-121.39094,0.28344613070823077,0.0
862,{230F6AB0-FAD4-4483-8A20-CB516C0930AF},2020-05-28,"Approximately two inches long, on our front door. Didn’t get a picture but will try. Very dark in color yellow and black stripes with yellow head",Unverified, ,2020-05-29,47.035591,-122.829828,0.40928926260140375,0.1951219512195122
863,{CEE544E3-6A81-4A66-B706-0A690FEA0695},2020-05-29,There was a very large hornet in my neighbor and my yards.,Unverified, ,2020-05-29,47.938131,-122.233734,0.24028689271716344,0.3170731707317073
856,{BCCB7E67-84FD-4983-BB36-30FEA359135F},2020-05-29,"I tried to get a photo but they wouldn't stay still long enough.  I could see the orange on him from several feet away, it was very bright. They looked like a wasp almost except they were orange, and long.  There were several, too many to count hovering",Unverified, ,2020-05-29,47.32517,-122.352557,0.35803292012274784,0.3170731707317073
865,{8A0D127E-929E-4614-8E55-4F2DCE420C42},2020-05-29,"Saw several in the last few days.  On zoomed just 3 feet away from me so I got a really good look. At first I thought it was a really big bumble bee, but it had way too much orange color in it.",Unverified, ,2020-05-29,47.675522,-117.16365,0.8516353720414427,0.07317073170731707
869,{7E298AF5-B353-4EA0-BC83-34AB464F9965},2020-05-29,I just reported the hornet a few minutes ago and forgot to mention that the hornet was 1.5 inches long and we have it in a plastic bag in the refrigerator at Twin Falls Hydro.,Unverified, ,2020-05-29,47.444806,-121.687647,0.3679871935101632,0.0
898,{DDDEA5F0-4935-4220-99D2-56759F228BCB},2020-05-29,Saw 2 small holes on our property with one still being dug and took a photo of the large insect I didn’t recognize.,Unverified, ,2020-05-30,47.822319,-122.356278,0.2568381034849452,0.24390243902439024
876,{219D4111-BAE4-4D55-8B31-4BCD075531D0},2020-05-29, ,Unverified, ,2020-05-29,47.921738,-122.123279,0.25008925044815117,0.024390243902439025
877,{9C39958F-471C-43D4-8CB3-89990DBB7F0F},2020-05-29,"Hornet was about to fly in boat, started to engage it with stick. Flew off , not the normal hornet quite large.",Unverified, ,2020-05-30,47.527488,-122.313109,0.3181284750706408,0.2682926829268293
859,{8CA9D745-B8A9-4BEC-B2F5-018CE0B2857B},2020-05-29,I have it in a plastic bag. It would not let me add a photo.,Unverified, ,2020-05-29,48.198246,-122.117404,0.19999506274116613,0.14634146341463414
858,{D67566F6-F4D8-4571-A965-0D4C5BCA417D},2020-05-29,We found what looks like a dead Asian Hornet.,Unverified, ,2020-05-29,48.198246,-122.117404,0.19999506274116613,0.14634146341463414
861,{CED67FD5-6E2A-4AAB-AC41-F19C50B698A1},2020-05-29,I believe i seen this hornets on my front yard,Unverified, ,2020-05-29,47.308803,-122.368606,0.36087564184364845,0.24390243902439024
925,{EF11033A-BAC6-4034-816A-2F746C5721E0},2020-05-29,Got a decent look at one. It was at my kitchen window.,Unverified, ,2020-06-01,48.117521,-123.164138,0.1823063834958831,0.024390243902439025
853,{C6CD6D2D-04FF-47A6-BB47-37B6268E6CE6},2020-05-29,Curious if this might be a murder hornet,Unverified, ,2020-05-29,49.21687,-122.6053,0.053527481542247755,0.0
852,{0D87B50B-6A80-430F-B8D8-089BA7A93BD7},2020-05-29,Did not see the hornet. I found several decapitated bees on my deck,Unverified, ,2020-05-29,48.933477,-122.789643,0.02030352748154225,0.2926829268292683
850,{945B575B-41B2-408E-A2A9-B1F3C12CA628},2020-05-29,"No photos,however, I did research this after destroying the nest. They were very aggressive. My place is 7 miles west of packwood.",Unverified, ,2020-05-29,46.61019,-121.66939,0.5309186339744175,0.024390243902439025
958,{9A2940C8-647C-4553-9127-8ACF8358D4A8},2020-05-29,was cuttuing wood on west branch le clerc creek rd  .  a 2 to 2 1/5 inch hornet landed on my wood racks about 1 foot from my face . after looking at the photos on here  I am 100 % positive of what I seen .,Unverified, ,2020-06-05,48.550473,-117.297445,0.784048096496825,0.0
906,{5423E400-FEAA-4869-8F7E-0B6919139D21},2020-05-29,"sorry no photo, it surprised me. It was very large,very fast,approx. 2"" length. sounded like a bee except in a lower octave. It had landed on some wood rounds drying in my driveway that have a lot of sap oozing from them. hornet shaped body (skinny waist",Unverified, ,2020-05-31,47.30324,-122.105026,0.3721401877677513,0.04878048780487805
2201,{28A6B76C-87F4-4B15-BA8F-01A43B3D4073},2020-05-29,"A workman at our house pointed out a hornets nest attached to my rhododendron in the front yard.  He said there were evasive hornets in the area.  I saw a single, very large hornet utilizing the nest.  Knocked down the nest and stepped on the hornet.  Th",Unverified, ,2020-08-01,47.82972,-121.957097,0.2782601099869353,0.07317073170731707
854,{3DCE6709-A9B7-42AC-A30E-1F711380CDAA},2020-05-29,"Flew slowly by me 2"" orange feet hanging",Unverified, ,2020-05-29,47.12382,-122.186254,0.4051134809953514,0.0
920,{6C937865-46CA-4D87-842D-477EA7D81F1E},2020-05-29,"On our back deck saw several wasps and was checking the rafters of the roof for more. Were we live dealing with the wasps and hornets is an every summer event. While checking my husband asked me to look at this bug. I was ~ 10-12 inches away, saw a large",Unverified,"If you see the insect again, please try to get a photo and resubmit a sighting.",2020-06-01,47.927264,-117.214448,0.826835141129645,0.0
888,{46B1C49A-8ABA-4D09-85D5-EA1FF5DCA368},2020-05-30,"I saw what appeared to be one of those killer Hornets, I work for a preschool and we are outside a lot with the children especially on nice day and I've seen a lot of different types of bees and this one was a new type of be. It stood out because it was",Unverified, ,2020-05-30,47.736186,-122.352744,0.27429701029988146,0.34146341463414637
886,{D1192BFA-5B5A-43FC-8FD9-D3F90B9D551A},2020-05-30,"Large about 2 inches, interested in reddish exposed insulation, did not attack nearby dog, was not seen again after bringing the dog back inside.",Unverified, ,2020-05-30,48.99257,-118.510126,0.606422614164616,0.0
882,{AE30F73C-3FA4-44A0-8C80-F157C1265183},2020-05-30,I am fairly certain we just saw one here in Spokane Washington in my backyard my dog was chasing it from about 20 feet away it look like it was 2 to 2 1/2 inches long possibly could have been a bumblebee didn’t look hairy or fuzzy I tried to get a pict,Unverified, ,2020-05-30,47.654513,-117.347817,0.8289714550481574,0.0975609756097561
579,{F6ED83A4-919F-49EA-9097-705D3C33AAE0},2020-05-30,"In Kennewick WA, 1402 14th street. While on the driveway working on a car this rather large bee flew over me and landed. It was easily over an inch in length. It's head was facing away from me, but I noticed two distinct and unique things. 1. The abdomen",Unverified, ,2020-05-08,46.235758,-119.215773,0.7836588126272295,0.024390243902439025
905,{30473C97-1005-4680-A478-41FD84865C0A},2020-05-30,Yellow and black 2 inches long.,Unverified, ,2020-05-31,47.838772,-119.813459,0.4968990216631726,0.0
903,{9AFF6721-4CE3-4533-8443-FDB0B6E3D82E},2020-05-30,Found near window making a loud noise had to close my window,Unverified, ,2020-05-30,47.240828,-122.523386,0.37069319114027893,0.17073170731707318
912,{584251F7-F5A4-4E15-A1CF-75F20C5E1987},2020-05-31,I’m pretty sure I saw a killer hornet in Monroe on Ben Howard rd. I only noticed because of the size and what looks like fangs on the head. I’m around hornets everyday day during the summer and I’ve never seen a hornet this size.,Unverified, ,2020-05-31,47.842816,-121.96933,0.2750015191565643,0.0975609756097561
928,{EBE19784-CBA4-4D50-9B93-FE0CE30BA6FB},2020-05-31,I didn’t get a picture but it definitely looked like the pictures and not like any of the similar types of hornets or flys.,Unverified,"If you see it again, snap a picture for us.",2020-06-02,47.365221,-120.22014,0.5107917084434723,0.0
386,{7417B015-33A7-4375-8297-D555CF309E11},2020-05-31,Long and at least 1.5 long (2) of them,Unverified, ,2020-05-05,48.280032,-122.673324,0.15138585057576037,0.07317073170731707
973,{50E72362-0316-4F98-B173-CC557CF7BE58},2020-05-31,"Did not get a picture, saw the back of the bee as it crawled back into a hole by the flower roots while I was weeding.  It looked almost like a yellow jacket but was orange. Unfortunately I did not see the face.",Unverified, ,2020-06-05,47.875683,-122.209308,0.25375231671376053,0.1951219512195122
1033,{9FF8CFA6-B32A-41E4-8753-2CC6F24E1FC1},2020-06-01,We have a dairy farm out near Acme Washington.  I was showing my kids the pictures of these and my 15 year old told me he thought he saw one out here a couple days ago.    He said he was in the cab tractor and the biggest 'bee' he had ever seen flew in t,Unverified,Here is a trap tutorial:   More information can be found on our website:  .,2020-06-12,48.760676,-122.208709,0.10823420836751436,0.024390243902439025
923,{AB312EB7-F0AB-4BD8-B91D-8F1E6D2C4BBF},2020-06-01,I saw a flying insect in the bushes. It had orange stripes and a curved body.,Unverified, ,2020-06-01,47.25513,-122.44164,0.36979119193024035,0.34146341463414637
1046,{5744EBF3-A363-4329-A7FF-E1BE8FF7BBA2},2020-06-01,Saw clearly at our sunroom window. Hornet was above a rhododendum bush that was teeming with honey bees. We were mes erized by it's size. No picture though but it was clear that it was the hornet to us.,Unverified, ,2020-06-13,48.774065,-122.5013,0.07261378482666425,0.5609756097560976
942,{9FBDA149-8D4D-46DF-85B3-4AD08C855091},2020-06-01,I believe with confidence that I observed an Asian Hornet while mowing my field. I did not have a camera with me. I am willing to set and monitor traps if they can be sent to me. This area is adjacent to commercial garden and farming including honey coll,Unverified,Hello. Please check out our trapping information here:  ,2020-06-03,47.805091,-117.23439,0.8325813508340171,0.0
919,{E8746898-146B-41FA-B4C2-2B15237B1559},2020-06-01,Was only able to view the hornet in flight.  It was very large and had a very distinct bright orange color and sounded like a tiny tin toy as it flew by.  It flew over Cordata Park Trail in a north direction.,Unverified, ,2020-06-01,48.807622,-122.500957,0.06835255066387141,0.12195121951219512
922,{6A399CBF-D85F-4E99-A11E-F17D2AFC7EDE},2020-06-01,Asian killer wasp. I thought it was a hummingbird until I did a double take.  It was approximately 2 plus inches long with a large stinger.  Small waist large back side.  We have had a paper wasp nest on our trees in the past and problems with wasp in ge,Unverified, ,2020-06-01,47.264744,-122.129255,0.3788225777048583,0.0
950,{25BA5F9F-56FE-400C-9714-72A9FACD0E81},2020-06-02,I was walking towards the N22 parking lot at the University of Washington Seattle from King Lane NE (next to the hub yard) and it was flying on my right side near the bushes when I was next to Thompson hall.,Unverified, ,2020-06-04,47.656272,-122.305817,0.2923958618175189,0.5121951219512195
935,{D7FA6BF0-5D05-41B6-BE59-E98BB96A2DC2},2020-06-02,Found hanging on my screen door. Sprayed with hornet spray and it dropped to the ground.,Unverified,same as 1831,2020-06-02,48.930139,-122.521446,0.05404019688269073,0.0975609756097561
969,{CFB4336E-5FA2-4985-BE63-8DC4F3E5F478},2020-06-03,"While mowing lawn, notice what I believe was a Asian giant hornet. I thought about capturing it but then would need to leave it to get a container and was concerned it would leave.  So I killed it with the lawn mower blade.  Needless to say, nothing was",Unverified, ,2020-06-05,47.458765,-122.271235,0.3337302129857503,0.2682926829268293
952,{D0270C37-A37F-4168-9C4B-4D2CB534AD05},2020-06-03,The hornet was flying in a northerly direction toward our raspberry patch where there are a large number of bees. The hornet was flying much faster than other insects normally fly. There was a distinct loud buzzing sound.,Unverified,"If you see it again, please snap a picture and resubmit a sighting.",2020-06-04,48.894085,-122.788026,0.026133290796949538,0.0975609756097561
965,{AA7284DD-E8A7-4F7C-BBC0-F1E9217AE6F3},2020-06-04,Seen it on my sliding glass door. Its wings went past the rear. 99% sure it was one. My friend was the one who spotted it. Tried to get something to kill it but it flew away,Unverified, ,2020-06-05,47.975322,-122.083426,0.24270235165436155,0.14634146341463414
970,{C4642A23-0289-401B-B4FE-6B5C6DCF2B8A},2020-06-04,Sinclair island. Seemed stunned after I swatted it off my daughter. Larger then any bee/hornet I’ve ever seen,Unverified, ,2020-06-05,48.3761,-122.40306,0.14687775347127274,0.0
1259,{8E63543D-AEB3-4074-8F53-079BC4657476},2020-06-04,Suspect flew around me for 10-20 seconds. I’m allergic and was scared! No photo and I’m sorry. I tried to reach for my phone to take pictures but it was too dangerous,Unverified, ,2020-07-02,48.937187,-122.644326,0.03751367240907849,0.2682926829268293
972,{D8F21BBA-7ED8-41EE-B068-1C2030580FBD},2020-06-05,"Orangish, red big bee spotted in Rose bushes at our condo in Renton, WA.",Unverified,"If you get a chance, take a closer picture.",2020-06-05,47.501456,-122.187503,0.32870560264940907,0.17073170731707318
966,{A740E6EE-BBE7-4F43-B617-BFA53B7E1B5A},2020-06-05,found in a oil pan,Unverified, ,2020-06-05,47.167626,-119.571279,0.6079132865433112,0.0
957,{36A8ACE4-62BA-4C0D-80BF-CF41549C7DA4},2020-06-05,"June 4,2020 500",Unverified, ,2020-06-05,47.852248,-121.843947,0.2823067632850242,0.0
979,{8D023A92-A0ED-4CD9-90DA-F65586B38092},2020-06-06,"Found in back yard. Lynden, Wa",Unverified,There is no insect in this photo. Could you try to upload again?,2020-06-06,48.993619,-122.401694,0.0677391912010452,0.024390243902439025
980,{CC8AB618-1999-4331-88D8-A920830F40E8},2020-06-06,"Hi, I was looking outside my sliding glass door and was going to water my plants and I saw a very large insect buzzing around. I did not get a picture, I was so shocked. I did see some orange color but it is dark and rainy here right now. I went out and",Unverified, ,2020-06-06,47.305791,-122.344547,0.36227896271989796,0.24390243902439024
1023,{E9935752-F9DE-4F34-918F-A586F7A237E7},2020-06-06,Not very active.  Found on porch,Unverified, ,2020-06-12,48.992578,-122.252462,0.08836743839820134,0.024390243902439025
1024,{2D909870-3869-4F56-A523-6525F6D24B34},2020-06-07,"Potholes State Park Campground we found 2 just at our site (66). Very large, 1 was slower than the other, and could not catch due to child near me with severe allergies.",Unverified, ,2020-06-12,46.97082,-119.34974,0.6592398900130648,0.0
1007,{FBF2BE7C-F85D-4D3F-8BB0-34AE5DE6C634},2020-06-07,I seen it from our deck flying next to our neighbors house.,Unverified, ,2020-06-11,48.865377,-122.58746,0.05156397168292166,0.4634146341463415
985,{0A438A7C-11C6-4E03-9A58-AEFA827D2930},2020-06-07,Found this on my back porch.  Is it a yellow jacket?,Unverified, ,2020-06-07,47.638823,-122.343966,0.2943289885455595,0.8048780487804879
987,{7E2DB9CC-E472-4F05-991D-36C94C8F35AF},2020-06-07,I did not get a picture... but I am pretty certain that I saw one of these hornets. I was caught off guard when I saw a hornet that was abnormally large. I got a closer look and distinctly remember the yellow head. I suspect that it was just in transit a,Unverified, ,2020-06-08,47.478812,-122.158586,0.33456005225898583,0.17073170731707318
981,{F2C598DD-8840-475B-8400-9ED4DF8F1AB5},2020-06-07, ,Unverified, ,2020-06-07,47.148015,-122.324372,0.3953889800382827,0.12195121951219512
2151,{2423E1F3-D303-4CB6-9E49-884CBDBD6095},2020-06-07,"I saw what looked like the hornet in this article resting on my arbor. I got within 3 feet until I realized what this could possibly be. I ran back inside to get my phone to take a photo, but when I got back outside, it was gone. I stood there, looking a",Unverified, ,2020-08-01,47.283,-123.04477,0.35674353598881897,0.024390243902439025
1027,{D3B1F408-DEC3-4DB6-858D-EB537FA3E229},2020-06-08,It was by itself & locked in our office building & seemed like it was dying,Unverified, ,2020-06-12,47.9796,-122.35803,0.22548271199829856,0.0
991,{13EBA05D-C9EF-4893-9210-FD9C1D8CE23D},2020-06-09,Flew in an open window at our farm house. Dakota Creek runs through our property. There is a honey bee farmer in the field across the street. The obvious black and orange stripes were unmistakable. It was definable over an inch long. Its buzz was loud en,Unverified,We encourage you to get a photo and resubmit a sighting.,2020-06-09,48.971702,-122.697182,0.028163263755962693,0.12195121951219512
1026,{C6845E62-9F88-42B0-90FD-489BCC92BCDE},2020-06-09,On m’y porch very big and scary I tried to get a picture and my phone was dead,Unverified, ,2020-06-12,47.66821,-117.10087,0.8605091453225171,0.024390243902439025
1001,{E4804ED0-1627-4BF6-A7EB-311E5A14DBBD},2020-06-10,"I saw a giant hornet (about the size of my pinkie finger) outside my second floor window this afternoon like nothing I've ever seen before. It had a HUGE orange face, black neck, and orange body. I wasn't able to get any non-blurry images or video, but I",Unverified, ,2020-06-10,47.562791,-122.288316,0.3119834867681463,0.12195121951219512
999,{77531760-FDBF-4C48-86D0-62A55E3B4564},2020-06-10,Just spotted outside my second floor window: A HUGE wasp with a big orange head and orange body. I tried to take pictures but it was moving too quickly and they are all terrible. I am attaching a very bad video that I don't think will be helpful but you,Unverified, ,2020-06-10,47.562791,-122.288316,0.3119834867681463,0.12195121951219512
1014,{1D652AD7-DBA2-44CD-95E7-74F9C641076F},2020-06-10,I am 99% sure that I saw a Asian Giant Hornet yesterday around 5:30 pm in my backyard hovering around the blackberry bushes. I didn't have my phone with me to snap a picture so I ran in the house to grab it and didn't see it again when I returned. Is the,Unverified, ,2020-06-12,48.950061,-122.78254,0.019128080089934073,0.36585365853658536
998,{CA77FED9-D312-41F2-8A0B-B53A608B8254},2020-06-10,A large Japanese hornet landed in the lawn outside my townhouse. I quickly brought my dogs inside. I didn’t not try to capture the specimen. Please let me know any follow up information. Thank you.,Unverified, ,2020-06-10,47.231853,-122.536281,0.3722693160757148,0.17073170731707318
995,{540E8D36-FF0A-42CF-AB8F-90E642067A57},2020-06-10, ,Unverified, ,2020-06-10,47.970879,-122.805101,0.21252050861361776,0.0
